{
  "protocol": "sovereign.command_result",
  "protocol_version": 1,
  "request_id": "d22214a5-544f-4add-af85-9bed4691a44b",
  "status": "rejected",
  "delivery": "original",
  "kind": "edit",
  "actor": "agent:place-banner-example",
  "scene_id": "8d4684d6-93cd-5d04-a868-b4d839bafda7",
  "revision_before": 2,
  "revision_after": 2,
  "commit_id": null,
  "target_commit": null,
  "request_hash": "0aea9cc63e2f84929548717420871acf56c7af24020668c864f7ab27be7ffacf",
  "operations": [],
  "errors": [
    {
      "code": "stale_revision",
      "message": "base_revision 1 is stale; the scene is at revision 2. Re-read the scene and resubmit against the current revision.",
      "path": "/base_revision",
      "op_index": null,
      "entity_id": null
    }
  ],
  "warnings": [],
  "diff": null,
  "conflict": {
    "base_revision": 1,
    "current_revision": 2,
    "commits_since_base": [
      {
        "commit_id": "abb4ada7-22b7-40cc-af9c-24ada61e7a4a",
        "kind": "edit",
        "actor": "agent:place-banner-example",
        "base_revision": 1,
        "new_revision": 2,
        "label": "batch d6b2c6fb-c818-4ce7-b638-fa37e41422a0 (3 operation(s))",
        "entities": ["4b64139c-ec7c-5014-944d-69cb98f1a8d9", "6b45d759-a0c1-5147-9db2-6e7bab9f474f", "973060cd-d005-51f6-9b5a-265a9ac9031e"]
      }
    ],
    "history_complete": true
  }
}
